这么好的卖家如果将来我再也遇不到了那我该怎么办直到我毫不犹豫地把卖家的店收藏了价格便宜实惠五星好评这么好的卖家如果将来我再也遇不到了那我该怎么办直到我毫不犹豫地把卖家的店收藏了我内心的那种激动才逐渐平静下来可是我立刻想到这么好的卖家倘若别人看不到那么不是浪费心血吗经过痛苦的思想斗争我终于下定决心牺牲小我奉献大我我要以此评价奉献给世人赏阅我要给好评评到所有人都看到为止,irr
此用户未及时评价系统默认好评,irr
11抢到了真心不错,irr
工作需要一贯的信赖没有考虑直接选择了小黑,irr
好好好好好好好好好好好好好好好好好好好好,irr
刚买第二天是原装正版的质量也没问题可以连手机的热点上网挺好的鲁大师跑分17万多谢谢联想谢谢THINKPAD谢谢客服的耐心指导,irr
好东西不贵给妹妹买的笔记本表示很喜欢,irr
宝贝很棒运行速度不错使用起来舒服,rel
送货速度快购买四天后降了价京东退了差价,irr
公司买来开发用的发货速度快价格实惠,rel
双十一的活动现在就到了包装的很好拆装的很小心大爱客服很热情推荐,irr
漂亮精致cool,rel
特别好特别好特别好特别好特别好特别好特别好特别好,irr
机器还是很好的用惯了小红点这次就买了这个办公用吧从win7过渡到win10的win10的系统中看不中用经常强制更新10几个小时过去了还是这样唉,irr
用着体验了一把确实不错也很满意唯一的就是刚买了一天就有道子了不知道怎么整得,irr
vvv过户u哈哈更丰富哒哒哒短发干哈,irr
很漂亮的笔记本操作也比较顺畅,rel
商品还不错是正品物流也挺快的,irr
帮朋友买的到货超快,irr
联想ThinkPadS22017款02CD133英寸轻薄笔记本电脑i57200U8G256GSSD背光键盘FHDIPS银色联想ThinkPadS22017款02CD133英寸轻薄笔记本电脑i57200U8G256GSSD背光键盘FHDIPS银色,irr
买了一个粉色的MacBook很适合女生使用视网膜屏看过以后公司的电脑就没法看了觉得眼花啊很轻基本带出去就是大一点的ipad准备以后休可以不用带公司电脑了物流快递惊人中午下单下午5点就收到了,irr
挺好操作不太习惯买来在家做PPT用随时随地联网方便,irr
经常用联想笔记本效果还不错,irr
机器性能很棒哈很漂亮速度快挺喜欢的,rel
到货好几天了刚拆开比其他店的便宜心怡了很久,irr
本本超薄还很轻,rel
开箱打开原封很不错因为要送人就不打开了都一样的苹果的东西不错京东送货很快,irr
东西收到了还不错就是还不会用苹果系统得适应一段时间,irr
质量好服务好,irr
物流快快的开机效果很棒服务态度也很棒一家不错的苹果店铺,irr
配置很高流畅双系统切换也很方便价格不太亲民有点贵,rel
轻巧便携用了几天性能还不错售后很有耐心推荐购买,irr
电脑还行手感满分物流满分体验满分好评,irr
是我想要的配置外观散热开机速度等均帅毙了,rel
这个480是之前470的升级版以前采购的都是470嗯感觉比1470的屏幕显得要大一些这个变窄了其他的地方相差不大双11的价格是非常合适的不是双11是双11预热的价格不一定等到双11提前买也更合适还送了电脑包,irr
可以的是正品物流有点慢,irr
没有色差非常漂亮实用,rel
很棒的一次购物快递一天到达真的666,irr
很好收到运行到20分钟的时候黑屏了现在在换机状态为苹果贡献一台官换机了期待下一台电脑正常使用,irr
笔记本的性价比也可以接受就是它的转轴和底部的垫上有点儿旧,irr
速度非常快很轻薄只是系统有点不习惯,rel
终于拿到手里了整体感觉非常好很显档次整体重量也控制得很好买这款机器就是看中256固态+1T机械硬盘存储数据不再捉襟见肘固态硬盘做成了C盘从移动固态硬盘复制数据的速度非常快而机器内部的固态硬盘拷到机械硬盘的速度稍慢一些但也在水准之上结合双11的特价比平时又便宜不少这样一款机器真的是性价比很高平时家用足以胜任,irr
很薄视觉感觉比之前X250X240要大轻薄了不少个人用的第三台X系列家里的第四台X系列,irr
电脑是好电脑只不过我要开始吃土了55555555555233333,irr
是买给小孩用的说是很好用就是不知道以后售后怎么样,irr
速度快性能好可惜外壳是国产的非金属,rel
双11购买的今天就到了物流超级快很喜欢价格很实惠体验了一下非常不错的acutets`以后会继续光顾,irr
期待已久确认为正品总体比较满意因为是苹果电脑的小新等用过一段时间再追评,irr
产品效果好好好好好好好好产品效果好好好好好好好好产品效果好好好好好好好好产品效果好好好好好好好好产品效果好好好好好好好好产品效果好好好好好好好好产品效果好好好好好好好好产品效果好好好好好好好好,irr
苹果系统运行流畅质量好,rel
不错冬天暖手宝用起来就是不一样很炫酷,irr
东西不错下次需要还来开机流畅手感也不错已经给朋友推荐了赞,irr
很好的一次购物自己买的用的服务态度良好,irr
联想ThinkPadE4802XCD14英寸轻薄窄边框笔记本电脑i37020U4G500GFHDWin10银,irr
机器做工精细材质好系统运行快飞一般的感觉高清晰看电视打游戏都合适屏幕清晰颜色好看无色差原装正品散热好电池耐用携带方便高大上物流快师傅态度好非常喜欢喜欢的可以现在入手哦特别值得平时上班也可以用适合多种场合大爱,rel
发货很及时上手感觉很不错,irr
不错的机器不错的东西很满意真的不错的手提电脑,irr
使用了一周除了自带的系统有点慢以外其他都不错,irr
原封正品序列号和电池循环全都靠谱运气非常好抢到了666神券比官网优惠太多客服也不错难得写这么多评价用了三天除了系统特有的小bug其他没有问题,irr
非常好的电脑一直信赖的品牌京东有活动也合适非常满意的购物,irr
非常轻薄显示屏很给力,rel
非常棒愉快的一次购物,irr
很好很好很好很好很好很好很好很好很好,irr
颜值高质量比较高可靠,rel
物流速度超级快早上下单下午送达使用一段时间再评价如果质量OK下次继续购买,irr
ffdfyibb,irr
收到啦第一次在京东上买东西非常棒没有失望外观非常大气快递超快晚上十点多下单第二天中午就到了,irr
送货是真的快信任京东电器之选不二法门,irr
好吃不贵味道挺不错极力推荐,rel
电脑超薄但发热严重,rel
这电脑蛮好用的英寸很小携带方便的很淹济媲逦打字也不小不错卖家服务也很好的,rel
电脑挺好用的继续光顾京东,irr
速度很快外观很好看是我的菜,rel
这本可以买性价比不错1屏幕大全键盘高分辨率显示清晰办公设计非常好用28G大内存7代i5处理器强劲开机只需几秒3外壳做工经典耐看多久都不会掉色4卖家服务好发货速度快有正规发票礼品丰富键盘膜笔记本包鼠标鼠标垫,rel
款式非常好看性价比也高,rel
一直想要macpro双十一终于买咯,irr
非常棒店家服务一流很耐心的讲解谢谢店家大赞,irr
机子用了一段时间还可以只是有时候风扇声音有点大其他都还挺好的,irr
质量还不错价格也实惠,rel
总体来说1产品做工一流2屏幕显示确实很赞尤其外放声音确实让人印象深刻3操作系统刚开始有些不顺手经过一番调教使用很起来方便4价格贵键盘手感不好长时间打字会很累,irr
超级喜欢薄款手感好小巧精致永远的最爱,rel
电脑非常好送货也快先验货后付的款方便保险,irr
颜值很高很轻薄物流也快系统很流畅很喜欢,rel
期待已久的宝贝终于到了兴奋必须好评,irr
8G内存256G固态银色固态硬盘本win10速度很快很满意用几天再来,irr
是正品包装很安全不会磕碰电脑很好用很流畅很开心的购物再也不用为了开机杀毒什么的浪费时间了,irr
单位领导使用期待好的效果,irr
很快很方便商家服务好,irr
macbook12颜值逆天待机时间也不错,rel
散热很好性能不错看电影不错屏幕大外观漂亮,rel
一直是ThinkPad的忠实用户把原来的X230更新换代了保持原来一贯的传统风格轻巧了不少,irr
昨天下午收的货晚上开箱还没来得及写评论今天早上一看就降200元说双节活动已经开始了这也太让人郁闷了吧,irr
好速度是快的价格是高的,rel
速度很快用起来很舒服不错,irr
整体造型手感非常好非常棒,irr
电脑用起来很方便不算重外接接口很多工程上用很方便快递给力,irr
双十一活动真划算果断出手,irr
没有送我包啊醉了一下买了三台没有人送我包,irr
绝对的正品用起来很舒服运行流畅w10系统也挺漂亮,irr
苹果就是苹果简约不简单主要办公用非常好,irr
好评发货快是正品经常在京东买东西放心,irr
开机速度快开机的系统设置人性化外观和手感越来越好了整体感觉这款电脑挺不错,irr
看起来很厉害的样子之前买的air真的用了好几年啊我觉得苹果的电脑和手机一样虽然系统变态接口神经价格但是流畅耐用是没的比的,irr
已经开机效果不错开机很快画质也不错我赶紧物有所值期待它是表现,irr
双十一的价格超级给力机器用得很爽太赞了,irr
屏幕音响很好,rel
办公大小刚合适屏幕是A4大小女生一般的中型包可以放的下,irr
电脑是是正品查过了颜值很高优惠力度很大送的鼠标有问题不过很快就解决了客服态度很好,rel
很好我很满意的也很好喜欢的和我想象中的是一样的质量也是很好的,irr
电脑肿么样我不知道不是我用不过京东服务是真不赖价格也实惠价格保护机制给满分,irr
好评好评好评好评好评好评,irr
机器很不错很有质感性能也很好暂时还没发现问题,irr
东西很好很完美发货速度神速送货小哥很好很满意全五分,irr
一直是ThinkPad的忠实粉丝十年前第一台笔记本SL410k到现在的E480前者为我自己创业立下汗马功劳XP系统到现在确实太慢了但是硬件确实杠杠的重装系统价格内存下放到农村为老爷子继续服务新来的E480跟前任比消瘦很多看上去弱不禁风的样子但是用着几天确实很顺手W10系统也没那么难上手希望能伴随后续继续前行就评论这么多了老婆过来看我认真写评论竟然生气了说跟她聊天都没这么认证,irr
最哦哦恶魔生气的是吃了那么久还没瘦,irr
完美体验很好,irr
这款笔记本电脑配置高性能不错,rel
物流很快包装完好哈哈很适合我这种经常出差的人系统要慢慢适应了,irr
第一次用苹果经验不足闹了个乌龙给店家添麻烦了用了几天没发现什么问题包装稳妥顺风速递也在官网查询了序列号显示正品国行货满意5分,irr
双十一的物流还可以也的确有降价电脑挺轻薄的便携,irr
没有想象中配置那么高端中途使用还能死机一次给人的感觉异常得不好使用效果不佳不是特别满意,irr
轻薄纠结了好久xpslaptop2matebookPro到手之后真的好,irr
联想的电脑可是电脑中的战斗机机型大气且耐用这次采购这么多台可见我对它的足够信任希望联想一如既往的不忘初心,irr
性价比非常不错的笔记本,rel
挺好用的但是不够纤巧有一定的质感,irr
不错哦电脑的性能整体上不错,irr
质量好速度快价格适中客服服务周到很满意,irr
颜值高体积小很适合女生,rel
屏幕很大包装很不错非常喜欢,irr
好好好好好好好好好好好好好好好好好好好好好好好好好好好好好好好好好好好好好好好好好好好好好好好好好好好好好好好好好好好好好好好好好好好好好好好好好好好好好好好好好好好好好好好好好好好好好好好好好好好好好好好好好好好好好好好好好好好好好好好好好好好好好好好好好好好好,irr
似乎office软件是要单独购买吧,irr
不错不错不错不错不错,irr
双十一便宜块日常办公配置可以了毕竟这个价位,irr
赠品啊啊啊啊啊啊啊啊电脑还不错哈哈哈哈哈哈哈哈哈哈哈,irr
超级漂亮的哦非常的轻巧可爱有质感总之很喜欢物流也很快,rel
刚拿到感觉蛮好快递哥也给力,irr
我是用了一周再来评价的很喜欢ThinkPad的独特设计所有的按键都在刚刚好的位置用起来特别顺手物流很快包装很好电脑外观很好看也很轻使用一周以来IE浏览器奔溃过几次其他感觉蛮好的还送了一个手提电脑包这蛮好的,rel
很好非常好很好非常好很好非常好很好非常好很好非常好,irr
电脑配置不错8G内存直接换成X64位专业版系统了不然有点浪费外观经典商务大小合适重量很轻电池比较耐用出差再也不担心马上就没电了机器是未拆封原装的发票也很快收到,irr
电脑真心不错还是高分屏的看片挺清爽,rel
速度快屏幕分辨率高整体重量很轻稍微有点遗憾就是没有鼠标电脑本身非常满意,rel
双十一活动真给力优惠了好多啊,irr
终于收到我需要的宝贝了东西很好价美物廉谢谢掌柜的说实在这是我购物来让我最满意的一次购物无论是掌柜的态度还是对物品我都非常满意的掌柜态度很专业热情有问必答回复也很快我问了不少问题他都不觉得烦都会认真回答我这点我向掌柜表示由衷的敬意这样的好掌柜可不多再说宝贝正是我需要的收到的时候包装完整打开后让我惊喜的是宝贝比我想象中的还要好不得不得竖起大拇指下次需要的时候我还会再来的到时候麻烦掌柜给个优惠哦,irr
以前自己买过一次这次介绍朋友买外观漂亮大气用着省心舒适真心不错,irr
本子还可以正在装系统赠品好用,irr
很好很好很好很好很好,irr
不错苹果系统非常流畅外观也美,rel
买就为了装B但发现买了之后身边的朋友更加讨厌我了我没朋友了只剩P果断打开硬盘岛片寻回自我,irr
想尝试苹果笔记本很久了终于如愿总得来说感觉不错已经在店家支持下安装了双系统慢慢用着看吧,irr
速度很快操作很流畅电量也够大挺不错的,irr
按键上有损伤,irr
满意满意满意还要送鼠标,irr
好评好评好评好评好评好评,irr
一如既往的好用十几年小黑老用户笔记本只选小黑而且必须是正宗的小黑而不是E系那种冒牌货,irr
送货很快捷商品是正品给客户买的没有拆包,irr
很好是银新机子电池循环一次自我感觉良好,irr
不错比想象中的薄,rel
还没打开看看,irr
第一次网购电脑这个价位性价比算可以了运行速度新机还行外观很轻便昨天才收到好多东西还有待测评还是要秒杀的时候来买东西我会继续用有问题会来追评的好用也会追评哦,irr
很棒哦客服也棒棒处理事情效率极快送货也快,irr
速度快不错可惜内存小硬盘也偏小点,rel
非常不错会有一点小小的漏电,irr
怎么说呢正品没错就是还不太习惯最近刚好又忙没时间用基本的办公软件还没装呢,irr
送人的没有见到无法评价但是物流很快,irr
给公司采购的还可以,irr
东西很好是正品苹果还是比较耐用的,rel
电脑用了一段时间感觉还不错画质非常清晰,rel
用了一阵了很好用外形漂亮做工精致质量上乘服务到位支持国货,irr
很好别人推荐的喜欢,irr
苹果的质量手感工艺谁用谁知道,irr
很喜欢方便实用朋友们见了都说好啊,irr
好好好好好好好好,irr
不错美观很薄运行速度快,rel
性能不错屏幕大键盘不错散热很好,rel
东西很好非常喜欢推荐购买和想象的一样,irr
起初购买初心就是家用也不怎么打游戏到手后颜值在线屏幕色泽还不错持续用着吧福利上老詹回克利夫兰,irr
到货很快包装也很好五分好评,irr
非常好非常愉快的一次购物,irr
还可以朋友很喜欢,irr
红红火火恍恍惚惚哈哈哈,irr
物流太慢服务太差差评,irr
好好好好好好,irr
产品非常薄看着非常上档次,rel
东西收到了是正品挺不错的物流也很快等用过之后再来追评,irr
第二个pro上一个不带bar果然升级颜色很棒自我感觉此银色高大上,irr
种草许久心水苹果的工业设计和精致的做工当然还有流畅的系统对于设计人员来说是件利器希望能扛个几年吧,irr
国庆买的双十一降了好几百机子好用没有接口,irr
超薄分辨率不错手感不错,rel
结界突破全世界兔兔兔兔营业执照宗门第八节课路路通,irr
性能很好而且散热系统很6,rel
活动价买的送了无线鼠标电脑包和清洁套装本本是固态硬盘开关机速度超快轻便好携带特别适合我这种出差多的,irr
非常不错的电脑很喜欢苹果永远是最好的,irr
质量杠杠的没话说谁让我就是喜欢呢下次还会来的,irr
不错不卡运行挺快的,rel
好评已经买了好几台了给公司实施用样式好看,irr
529半夜0点下单只是一个纸盒包装的笔记本今天看到联想商城的价格也是一样的7499还多了电脑包和鼠标相比之下京东太不给力还得另买电脑包和鼠标,irr
大品牌值得信赖给老婆买的老婆很喜欢,irr
很好用就是touchbar容易误触不太习惯,irr
卖家服务很给力的整体挺满意物流也很给力非常满意产品挺好,irr
很好用下次还会来的满意,irr
联想牌子可以京东不错,irr
618满意的购物送货很快收到了苹果笔记本十分满意,irr
一位计算机大神给我推荐的thinkpad买之前了解了一下性能方面的确比其他等价位的要好客服也很有礼貌到了之后发现比我想象中的要好可耐的小黑可耐的大包超级无敌喜欢这个包因为我不光是黑控还是拉链控这个包比我上个包多了好多分层可以自动分类了因为买的是14寸的所以不沉挺满意的比心,irr
开始升级系统一直报错后来更换网络就成功了就目前总体而言Mac体验很不错先给好评吧,irr
机器比我的原来X230快很多硬盘容量很够用固态开机10秒客服服务也很好,irr
电脑很轻出差携带方便好评,irr
真的很好用屏幕清晰好看系统流畅工业设计质感满满,rel
还行还行还行还行还行还行,irr
苹果还是不错滴价格也是辣手滴呵呵呵,irr
经常买的一直在用东西不错我们会一直用下去的,irr
硬件不错外观漂亮速度很快,rel
6499有点贵,rel
人生最高境界佛为心道为骨儒为表大度看世界技在手能在身思在脑从容过生活三千年读史不外功名利禄九万里悟道终归诗酒田园,irr
真的一分价钱一分货非常满意非常好用值得购买,irr
g'g'g'g'g'g'g'g'g'g'g'g'g'g'g'g'g'g'g,rel
很喜欢查验了是全新正品官网指导安装双系统也很耐心苹果的东西果然值得购买,irr
电脑是真心不错就是不给开发票,irr
十个字十个字十个字十个字,irr
用这挺不错携带方便小巧,rel
硬盘容量太小不知可否调换,irr
挺好用了一段时间才来评价就是系统不太适应验货是真的就是没小礼品哈哈货是顺丰送的,irr
键盘舒适第一次用ThinkPadfn和Ctrl键位感人huaweiimc希望你耐用,irr
电脑不错电脑不错,irr
挺商务有质感速度也快内存只有二百多g没用两天就去了50g不知道够不够用,irr
很不错的笔记本电脑主流配置运行速度快,irr
thinkpad老用户这款刚开始用还需要探索暂时没什么问题,irr
使用3天系统稳定流畅客服态度很好有问就答深夜也不含糊点赞,irr
货收到两天了亲自感受了一下运行流畅速度很快满意,irr
物流挺快用鲁大师测试跑分15万加用来办公足够了,irr
够贵的也没什么优惠不满意,irr
还可以暂时没发现问题,irr
质量不错物流速度很给力给公司采购的用品,irr
很好一直犹豫是pro还是X1后来想搞文字工作还得是IBM买了用着不错,irr
收到了是正品不错,irr
使用了几周感觉不错轻小巧系统流畅,rel
发货很快系统也很稳定很满意,irr
送人的没看到应该不错,irr
东西很好京东送货也超快非常满意,irr
国行正品价格公道赞赞赞,irr
为什么没给我寄发票明明信息都填好了,irr
不卡顿性价比高不错,rel
一周基本上手看电影学习编代码配上可爱配件已经爱不释手,irr
开机速度快显示清晰,rel
与描述相符办公也不错开始拍错套餐跟客服沟通后客服很快帮我用不差价的方式拿到了我想要的东西感谢,irr
收到以后整体还不错各种完整应该是正品,irr
曾在小米和联想间考虑许久最终还是选择了联想联想也没让我失望我个人不喜欢轻薄的总感觉不可靠这款就比较稳重属于自己想要的下单时就没考虑退货在同步买了250G的M2和8G内存当天拆机装上自我感觉优,irr
不愧是Thinkpad样子继承了老Thinkpad的灵魂,irr
喜欢好几年了也惦记了很久到手了也发现没啥用留着吧谁让习惯了mac系统,irr
还可以朋友要买的买电脑还是要买自营的有保障,irr
大小合适长得还算好看散热时声音有点大不时出一点小问题比如下载的网盘显示不清晰设置用户权限的时候出错导致我不得不恢复出厂设置当然这也有可能是我不太会使用造成的但是旧电脑我没出现过这样的问题有钱还是卖再贵一点的电脑吧,irr
66666,irr
很好很好很好很好很好很好很好很好很好很好很好很好,irr
外观非常漂亮开机速度非常快很满意,rel
GTX显卡配双风扇散热还有固态硬盘性能妥妥的好评,irr
非常不错质量很好很划算,rel
送的包太坑了尺寸是12的根本没用,irr
派件速度很快包装防护措施很到位配件齐全已经开机工作了慢慢在熟悉iOS系统操作,irr
物流速度很快快递小哥态度很快机子运行很快很好,irr
外观很漂亮啊手感很好值得够买,rel
款式好看小巧很适合我,rel
使用舒适比老电脑好用多了可以用个好多年了续航很好便于携带出差指纹登录很方便反应也快屏幕清楚不反光看起来舒适些键盘超喜欢开机也超快散热什么的耶还好偶有较大的声音第一台thinkpad好喜欢,rel
很期待一样漂亮好用送的包包质量很好客服服务很好,irr
收到了在试用中还不错的,irr
还是小黑放心啊轻结实耐用,rel
送给女朋友追剧的很惊艳女朋友很喜欢,irr
已收获速度还可以品质不错用一段时间后再追评吧总体感觉挺好,irr
这东西得用一段时间再看从目前情况看非常满意科研人员必备,irr
非常流畅超好配置续航时间长,rel
速度还可以18频率的比我惠普26频率的还快除了系统用不惯别的没发现不好的地方,irr
之前买过16年版本今年买的新版本确实好用,irr
帮领导买的硬盘最大的够用不做开发,irr
送人的礼物还是比较好的好用不好用就不知道了呵呵,irr
不错很好的哦,irr
这款电脑的优点是轻薄很方便塞到书包里带走其它评论所说的瑕疵没有看到之前的网卡问题更新系统后好了很多有事可能会卡顿但不影响,irr
刚入手客服回复超快,irr
还不错就是一直有京东金融打电话希望店家不要再泄露个人信息了,irr
买来就拆了傲腾换了建兴T11拆了500g硬盘换成了1t的希捷除了电源三斤多沉做工还行小红点没有想象中好使键盘手感好内三外三的电池打打字上上网能用五个多小时屏幕差打算以后再换个2k屏加根8g内存条附个跑分,irr
挺好的公司买的,irr
很不错超薄苹果很值得信赖物流也快,rel
东西啊不错下次还要光顾买买买,irr
送货非常快十分满意还没来及开机相信京东产品不会有问题因为特别忙碌一会有时间在研究怎么开机苹果电脑听朋友介绍的本来想买戴尔戴尔是游戏机虽然好吧但我不喜欢玩游戏因为要学习平面设计和花艺还有网络小说对于图片上的色差标准还是苹果电脑为宜在此谢谢这里的工作人员你们辛苦了,irr
速度物流速度很快使用也刚刚的如果有配套转换器更完美了,rel
很好性能很棒手机坏了照片比较模糊深空灰很好看,rel
很好公司采购买了好几台,irr
送货太快了比价之后更划算很酷炫,irr
小巧轻便外观好看只是初装应用开关机都很快其他等用过一段时间再看吧,rel
电脑有划痕说是外观问题多变性没办法处理你倒是卖锤子呢,irr
很好人生第一个thinkpad性能很好想了很久的电脑,irr
一直选购的这家商品大大的好客服推荐的X270收到货后简直就是惊喜呀服务也是大大的赞,irr
ThinkPAD的T系列买的就是情怀啊不错不错继续支持以前我的R400用了9年了还是杠杠的哦这次囊中羞涩就买了个T系列乞丐版准备把敖腾拿下来换上一个固态盘做双系统那就爽了一个系统不行立马启动另外一个系统一点都不耽搁事儿你们认为呢,irr
你们知道小白不我就是电脑运行速度快用起来相当顺手笔记本通病也有就是运行起来风扇时不时听到响声,irr
双11特价买的划算不少,irr
使用了几天还不错,irr
正品618的价格给力给朋友孩子买的送他的他说蛮好,irr
没得说性价比超高高大上,rel
非常棒店家服务一流很耐心的讲解谢谢店家大赞,irr
