用了一阵子才来评价Thinkpad还是一如既往的好不用频繁的换电脑了,irr
给组里买的有些小贵不过真心好用挺舒服的感觉,irr
质量不错外观大气,rel
第二次购买这款机子了好棒外观好看配置高运行速度快,rel
双十一入手价风扇运转的时候声音很大,irr
笔记本较轻速度还可以硬件安静不是很发热这个价格还是略微很匹配没有笔记本鼠标笔记本背包是遗憾总体满意日后感受再做补充,irr
挺好的电脑速度psinablaacutepsi快快快快,irr
跟她的系统磨合的不是很好但是真的好用,irr
苹果不愧是苹果特别好用不玩游戏办公极品,irr
刚开始用开机速度很快其他方面暂时还没发现小红点一如既往的好用,irr
质量很好京东发货神速真心比优惠,irr
相信THINKPAD对比了许多型号最后下手这款开机速度快散热不错而且银色的也很时尚耐看其它都不错整体重量可以接受还送了原装的包包和无线鼠标很好,irr
非常好京东的东西还是值得信赖的五星好评完美,irr
电脑很漂亮质量和速度都还不错,rel
开包初始设置完成外形很满意不用说一直用thinkpad的电脑操作也顺手目前电脑整体评价很好送的原装包和鼠标不错其他的个人觉得不怎么样我愿三样变一样送个好点的,irr
同事说很好啊,irr
电脑很不错送货很快赠品也比较丰富,irr
用着还可以吧办公用系统不卡挺方便就是太贵了性价比不高,rel
东西很好卖家发货很快很nice,irr
速度很快公司办公必备,irr
很好漂亮用着也很舒服,irr
好像有点卡开机的时候其他的还好,irr
目前觉得还不错,irr
有些失望商家太扣了就一个裸机连一个最不值钱的鼠标垫都没装配让人失望,irr
是正版没错系统也刚装好啦很棒,irr
电脑运行太慢了卡得不行,irr
八通道i58512win10pro价格刀国内i58256算下来刀价钱差不多果断下单尝尝鲜不过日后有可能八通道会有大幅度优惠但是着急用电脑等不了了先来说缺点1国内阉割版没有windowshello人像识别貌似阉割了IRcameraQuicklyloginwitheasewithWindowsHellousingjustthetouchofyourfingerortheviewofyourfaceifyouoptfortheIRcamera不知道是我驱动没有安好还是怎么回事等白天让客服解决一下看看优点一大堆想买的放心买吧,irr
不错运行速度挺快的,rel
买来送人的还不错价格不便宜,irr
买来了客服服务很棒因为我要报销各方面问的很清楚客服都很耐心的解答电脑到了很漂亮苹果系统真心给力用了两台再来评价越来越喜欢MAC系统装了双系统win10用来办公mac用来上网,irr
京东就是值得信赖商品质量没的说送货速度快服务态度好希望能保持哦,irr
以前也是这个牌子,irr
高端大气上档次很不错值得拥有,irr
外观精美非常便携出差好伴侣,rel
电脑很满意用起来很舒服客服有问必答用一段时间了再来追评,irr
体验很好刚开始有点不习惯,irr
谢谢售后叮当帮我了一个大忙笔芯,irr
高大上呀很棒很棒机身很薄适合我们这些商务狗,irr
很满意很满意很满意很满意,irr
用了一段时间感觉还不错就是有时发热有点严重还有就是后盖苹果的那个亮点没了取消了usb真的很不习惯还的发几百块买转换器有点了,irr
好用好看质量不错的哟哟哟哟,irr
使用起来速度还可以出差办公使用所以选择轻薄的说个小曲折刚买回来开机后发现电池电量显示0连接电源适配器后显示电池无法充电经过与thinkpad的售后工程师联系按照其要求操作后问题得以解决希望以后使用过程中一切顺利,irr
苹果的品质一如既往的OK系统流畅,rel
种草许久心水苹果的工业设计和精致的做工当然还有流畅的系统对于设计人员来说是件利器希望能扛个几年吧,rel
打开外观感觉很赞很商务用了几天感觉更喜欢散热还行刚开始打开有点不满意的是外观黑漆有点容易显出手指印不太耐脏但可以擦掉整体满意,irr
很好谢谢京东一直给我的信赖感,irr
东西很好很满意下次还会光顾的,irr
外观可以键盘可以但是usb接口插拔太硬了屏幕确实不清楚运行感觉有点卡顿,rel
帮同事买的还没看到笔记本打算帮他重装Win7系统这电脑应该办公还可以的虽然cpu有点弱但不打游戏应该没问题,irr
电脑很漂亮外观显得很大气这个颜色很喜欢配置没的说屏幕色彩很好尤其是双音响音质真的很不错,rel
可以的说哦,irr
送货快效果还不错,irr
是联想正品笔记本电脑老板人很好按照我的需求升级了配置还赠送了礼品以后有需要还来我非常满意,irr
除了分辨率太低的缺点外其它还不错,irr
挺好挺快不错,irr
屏幕用着很舒服啊方便,rel
性价比超高,rel
机械很漂亮超薄办公首选,rel
小巧方便携带速度OK双十一买的价格便宜不少,rel
很好办公用着很顺手携带方便竟然听音乐的音质也很好,rel
好好好好好好好好好好好好好好好好好好好好好好好好好,irr
东西收到了真是联想的很不错超轻便喜欢的朋友不要再犹豫了,irr
好好好好好好好好,irr
期待很久了由于着急使用当天一早就期待快递小哥尽快为我送货说实话电脑比官网要便宜当时心里还有疑虑后来看评论咬咬牙就下单了实时证明没有失望这几天经过使用非常稳定,irr
一如既往的支持京东省时省力方便快捷,irr
还是高级的比较耐用,rel
很漂亮手感很好碳纤维格高,rel
高分屏最小巧的就是价格够高,rel
第一次买ThinkPad见到的第一眼真的超级惊艳以为t480很厚其实已经很薄了而且双电池背面是平的以为双电池背面会突出用了一天电池表现良好开机速度和打开matlab的速度都比我以前的电脑块了10倍,irr
不愧是品牌值得信赖和拥有,irr
京东快递速度一流昨天收到的笔记本电脑用了一天才作评价最初是被它的外壳所吸引看过评论后下定决心购买Mac系统第一次接触还在慢慢适应但接触了之后觉得没有那么难而且很多人性化创意性的软件便捷性的创造真的佩服苹果的技术,irr
说实话挺好的总之我个人很满意挺满意的一次购物,irr
刚收到很好用客服解答耐心,irr
机子挺漂亮win10系统好慢给配的仪器上用质量保证就可以,irr
赶上活动价钱很美丽机器全新速度超快,rel
机器不错的只是开始不怎么习惯慢慢上手吧,irr
物流速度快包装完好电脑开机速度快配置不错很适合大学生使用店家服务态度好,irr
屏幕看着舒服电脑大气希望OK,irr
不错的电脑性价比高,rel
满意因为双十一之前买的当时问了能退差价后来双十一那天忘了问了还是按12号的价格退了差价服务特别好以后还会来的,irr
就是图个轻屏幕真是渣,rel
用了一段时间啦没出问题超棒,irr
电脑早收到了用了将近两周才来评论当时决定买Macbook是因为不喜欢用安卓系统容易卡明知道Mac办公起来系统不一样不会用还是买了慢慢摸索用会用的非常喜欢带出去也轻便,irr
还可以吧非常的好,irr
双11销售完了机子预约了一周才到现在已经用了五天从各方面表现来看不错无论从外观还是系统暂时没有找到可以让我不满意的地方买之前罗列了常见买家的问题吗拿到手这些天都一一试了或许是幸运但给我感觉苹果的做工真是无以伦比所以个别小问题都是不可避免的这是第一次换macOs用来更换以前的Windows看来确实不错希望后续没什么大问题,irr
外观漂亮配置精良精微显示运转流畅很棒,rel
thinkpad笔记本性能不错就是保修期太短只有一年,irr
看起来还不错就是物流不太给力可能遇到双十一,irr
首先外观上简洁轻薄就很满意延成了thinkpad一贯风格运行速度很快流畅窄边屏幕加大屏幕利用率目前使用感觉挺好,rel
电脑给儿子用的用了一段时间说好用屏幕够大够清晰机器散热一般上网速度快性能佳总体来说这款电脑不错性价比较高物流速度快配送员态度好这是一次愉快的购物,irr
上网速度不是太快不知是不是网络的问题,irr
苹果的东西没话说第一次用苹果系统还不是很习惯但是还是很人性化的显示也很好物流给力好评,irr
质量非常好下次还会购买,irr
东西不错店家很有耐心已经推荐同事希望卖家诚信做下去,irr
整体满意快递给力服务态度好只是不能直接验货需要确认后再验货还没用用过几天之后再评价,irr
性价比很高1050ti的显卡和i5的cpu再加上固态硬盘和超大8G内存这个价格确实很划算屏幕大看东西不累眼这个发货速度和物流速度确实很快我凌晨下单第二天上午就到货了不到30个小时从北京到济南快递员给我打电话时我都不相信已经到货了显卡鲁大师跑分接近10万分因为有固态硬盘开机速度特别快从按开关按钮到显示桌面只有不到10秒钟屏幕亮度可以调节就算是最高亮度看屏幕几个小时也不累眼屏幕质量高光源很舒适特别是音响质量更高都快赶上专业的外接音箱的音质了不亚于戴耳机3D立体环绕音而且音量开到最大也不破音硬件发热很少风扇的噪音很小非常安静平稳总之京东的ThinkPad华中授权专卖店是良心卖家卖真品实货,rel
AppleMacBookPro154英寸笔记本电脑深空灰色配备2018新款六核八代i716G512G固态硬盘MR942CHA,irr
操作系统强大便于携带设计师必备产品赞一个,irr
公司采购正常使用京东购买省心,irr
非常好性价比高速度超快,rel
送货准时苹果系统用着很适应自带办公软件用着用着就习惯啦就是觉得自己英文不够好啦哈哈,irr
不错送货很快一直在京东上购买,irr
电脑真的很棒向大家推荐,irr
昨天的秒杀今天就到手京东物流就像小黑一如既往的经典,irr
双十一送货速度仍然很快快递员很负责送到了还电话告知电脑包装完整使用起来很流畅不过像转换器鼠标等还得另外再购买好在京东送货很快,irr
无话可说正就一个字,irr
超级好非常适合我使用非常完美苹果就是好一定推荐身边的人,irr
物流迅速电脑开机速度很快很有质感电脑略重总体来说不错,irr
朋友很信任我让我给他买电脑买过一个又买一个,irr
产品很不错使用起来很快比家里的台式电脑还方便一些很满意,irr
很好很强大,rel
超薄超漂亮苹果就是高大上目前正在使用过程中过段时间再评价,rel
机器小巧携带方便配置完全够用,rel
机器性能很好256G基本够用屏幕非常好很满意双11的价格也很满意,rel
家怡情侣居家棉拖鞋简约舒适厚底毛绒保暖棉拖鞋男款深蓝4243YLS2731,irr
电脑收到说有免费的office办公软件怎么没有呢,irr
机器性能好散热快,rel
好激动终于等到了这款电脑看了几个月了就看上了ThinkPad的品质低调有内涵不喜欢其他游戏本太炫酷的外表又想法戴尔G3但实体店体验键盘不怎么喜欢还是ThinkPad好听说键盘防水很好就打个英雄联盟不吃鸡要求不高这家店还送了很多东西省掉了我很多麻烦特别好客服服务也很体贴谢谢,irr
品牌日的时候随手买下的居然是现在价格最低的,irr
电脑很喜欢,irr
您没有填写内容默认好评,irr
Pro挺好的是正品可以在官网查询到,irr
熟悉了mac系统以后使用起来后如行云流水赞,irr
逼格还是挺高的不太喜欢苹果系统自己去装了个w10的系统操作起来不是很好用整体上来说有一丁点失望物流比较正常,irr
电脑很漂亮开关机速度很快,rel
质量挺好的而且手感也不错键盘比较软价格也便宜总体来说性价比高喜欢,irr
京东的产品价格非常好要比实体店便宜如果售后要像实体店一样就更棒了喜欢京东物流送货速度很棒质量不知道先夸一下物流吧京东价格非常好要比实体店便宜如果售后要像实体店一样就更棒了喜欢京东物流送货速度很棒质量不知道先夸一下物流吧,irr
电脑发货很快去官方服务店装了个硬盘目前没发现问题用起来不错性价比高售前冰冰服务态度很好五星好评,irr
电脑转载太慢了,rel
买了两台拆开看到有点小惊喜比x250薄了手感也不错系统是win10的同事很满意非常适合办公出差用很轻便,irr
电脑很不错双十一送给自己的礼物挺喜欢的家用挺合适价格很实惠隔天就能到货非常神速,rel
1.11E+23,irr
速度快的飞起物超所值,rel
哈哈哈哈哈哈哈哈哈哈或,irr
本子外观造型优美小巧方便携带刚拿到手时没有分区客服态度特别好咨询客服后客服打电话亲自指导如何分区散热性能也好还送了鼠标,irr
电脑非常流畅电脑外观很好看轻薄便携自带正版office套装很赞,irr
非常好物有所值非常好物有所值非常好物有所值非常好物有所值非常好物有所值,irr
不错性能好昨天入手后随即更新赠品皮包也非常满意质感不错其他的赠品可以忽略了恩,irr
用了一段时间整体来说感觉还是很棒的只是感觉自己有点浪费都说pro性能比Air要好但是对于我看看网页做下工作表格看看视屏来说好像有点浪费当然这个价位对比win的配置那就差多了不过苹果家的配置一向不高胜在系统所以体验感还是挺棒的做工无敌,irr
公司使用还可以,irr
haikeyiba,irr
电脑不错Mac做开发就是好用,irr
外观漂亮机箱小巧质量不错,rel
Windows阵营最好的办公本没有之一反正我又不写代码excited,irr
赠品没一起送过来,irr
太晚拿到货就不上图了东西很赞真的很赞尤其喜欢3D环绕音效研究研究怎么用过段时间上图,irr
第二个Mac本了屏幕大性能好大触摸板很爽指纹解锁也很方便,irr
棒棒价格比自营低而且还送礼品苹果电脑真是真棒是正品客服也挺负责的马上要去补差价了,irr
这个颜色是我很喜欢的感觉比银色好看很多很流畅目前没发现什么问题应该是正品没错,irr
挺满意的心水好久了以后再慢慢学,irr
外观很漂亮啊手感很好值得够买,rel
有时候会闪退黑屏刚开始用还行后来就不知道了,irr
不错外观时尚精致运行速度也可以可以满足我的需求,irr
公司使用还可以,irr
质量不错不过为什么都10天了还没给我发票真是的,irr
很不错的电脑给力,irr
第一次接触MAC系统经过两天和学习摸索愈发爱上MACOS的简洁和实用先说优点1触摸板很实用配合command+热键那叫一个舒坦2灰色机器颜值高屏幕效果没的说3蓝牙开启后居然能通过AppleWatch自动解锁碉堡缺点也明显金属外壳兼顾到颜值但防滑性太差容易脱手尤其跟以前磨砂面板的小黑比总之瑕不掩瑜90分,irr
到手后包装很简洁开机设置之后用起来没什么问题很流畅总的来说除了物流慢一点别的都还好,irr
还是挺可以的比较流畅跟新的的Mac系统黑色的搭在一起很棒,irr
很流畅屏幕也好看,rel
用了一周了系统很流畅稳定指纹解锁也很方便,irr
质量好性价比高,rel
性能不错值得信赖的产品,irr
没什么问题好评,irr
质量稳定可靠日常办公的好选择值得推荐,irr
只有买的那一刻是最心疼的买完后每天都很开心,irr
真的超棒查过了是真的,irr
这么贵的电脑如此低分的屏幕联想没底线了竟然没有背光键盘AM年代了总说支持国货专坑国人吧,irr
商品非常好拿回来不会用客服很有耐心的解释电脑轻薄外观好看下次还会再来买祝卖家生意兴隆,irr
不错不错不错不错不错不错不错不错不错不错不错不错不错不错不错不错不错不错不错不错不错不错不错不错不错,irr
递送速度很快包装很好满意,irr
不错您值得拥有,irr
这次物流体验是我用京东数年来最糟糕的一次笔记本买了好几天在杭州分拣中心弄丢了愣是到不了配送站只好取消订单但是这个笔记本又有赠品赠品先到了麻烦的处理流程总之耗费了10几天双11买的笔记本总算取消了重新购买,irr
买东西只选择京东放心服务好,irr
很棒办公超级方便超级流畅还会继续光顾的超级喜欢,irr
一如既往的好一如既往的好一如既往的好一如既往的好一如既往的好一如既往的好一如既往的好一如既往的好一如既往的好一如既往的好一如既往的好一如既往的好一如既往的好一如既往的好一如既往的好一如既往的好一如既往的好一如既往的好一如既往的好,irr
够轻够薄够小配件仅有电源还在选购配件中,irr
给力点个赞物流又快用段时间再加评论,irr
用了一段时间不错轻便快捷,irr
很不错非常精致,rel
1裸机什么包鼠标都没有2offce2013都是没有的版本已卸载新安装其他版本3本身只有一个逻辑盘需自己分盘新电脑都要这样的吧在win10系统中C盘最小只能小到119G其他的还好相信这个牌子的质量,irr
经过多日使用运行速度快质量很好,rel
相当不错从包装就可以确定是正品,irr
品牌好性价比高速度很快,rel
好好好以后还来买,irr
已收到货了非常喜欢一周后复评无问题将五星级点赞,irr
包装的很严实很正规快递服务也不错质量也很棒购买前对比了几家最后证明我的选择是正确的,irr
您没有填写内容默认好评,irr
赞赞赞赞赞赞赞赞赞赞赞赞赞赞赞RQ赞RQ赞RQ赞RQ赞赞,irr
电脑很nice就是建议大家如果要双系统的最好买大点内存的,irr
有钱就是好我学生时代梦寐以求的东西终于实现了送的包包和鼠标也很好看,irr
喜欢超级轻美丽就是没有office系统,rel
您没有填写内容默认好评,irr
东西不错啊很喜欢high哈哈哈哈哈,irr
终于等到双十一降价赶紧买了下来一如既往地精致的产品比上一台更加薄了开机速度很快机子外观细节处理的很好超级喜欢,irr
价格便宜实惠送货速度快感觉非常好,irr
电脑已经收到了非常的满意,irr
还是很信任京东的用得挺好的外观也不错,irr
电脑看起来不错用起来键盘的手感也很好屏幕很清晰唯一就是看视频时容易发热,irr
质量非常好与卖家描述的完全一致非常满意真的很喜欢完全超出期望值发货速度非常快包装非常仔细严实物流公司服务态度很好运送速度很快很满意的一次购物,irr
性价比很高值得购买哦,irr
很好很满意,irr
很好用很好用很好用的,irr
还行吧就是屏幕有点漏光待机时间有点短就是日常看电视办公用下够了不过觉得有点重,irr
性价比超高的本本可以入手,rel
发票邮寄不及时,irr
Haohaohaohaihaihaihaihaihai,irr
小巧速度还不错携带方便,rel
用mac好多年最好用系统没有之一着看着舒心摸着舒服用着顺手,irr
宝贝已收到非常好在官网也查了是正品未激活之前一直在用公司的Mac现在可以用自己的了,irr
简直完美价格贵是有原因的确实好用低音很浓重色彩很好,irr
物流很给力东西收到的超快看着不错是苹果的品质,irr
还没拆封应该还不错,irr
大爱第二台,irr
5月30号下的单今天收到的货还不错挺满意的,irr
双11买的便宜了很多苹果的产品还是很酷的虽然1万多块真的很心疼主要是玩摄影修图必须要买一台充电的时候稍微感觉好像有一点漏电不知道大家的有没有这种情况苹果的系统还是第一次用很多地方还需要慢慢的习惯,irr
好好好好好好好好好好好好好好好好好好,irr
非常好用刚开始还不太习惯OS苹果系统习惯了感觉还挺方便的一个触控板就OK了,irr
东西不错已收到运行速度都还可以好评,irr
笔记本电脑挺好的漂亮速度快,rel
京东速度很快联想电脑一直都在用,irr
非常好的笔记本强烈推荐T480效率提高,irr
快递给力正品晒晒,irr
收到了感觉还是不错,irr
之前公司用的15寸的感觉不错本来想入一个air实地看过后还是入了pro屏幕确实强太多了这家送货还挺快东西暂时没问题还需调试好评,irr
用了几天才来评价非常满意老公用来办公的信赖京东价格实惠赞赞赞赞赞赞赞赞赞赞赞赞赞非常合适物流快送货小哥态度好信赖京东赞赞赞赞赞赞赞赞赞赞赞赞赞赞赞赞赞赞赞赞赞赞赞赞赞赞赞赞赞赞赞赞赞赞赞赞赞赞赞赞赞赞赞赞赞赞赞赞赞赞赞赞赞赞赞,irr
终于收到了特别喜欢用着很舒服值得购买值得推荐,irr
很薄很棒早买早飞起啊,rel
各方面都不错性价比很高think系列还是可以用用的,irr
收到了很喜欢用起来也不错键盘手感舒适外观也很大气点赞,irr
好看好用好看好用,rel
送货很及时就是客户端客服很垃圾颜色买错了本来想换颜色的塑封膜都没拆客户端的客服竟然说不给换也不给退态度很坚决真想吐槽这种客服还好电话客服立刻打电话给我还是比较满意的,irr
非常不错网速也很快用了一段时间再评论的物流非常快当天就到了,irr
首先品质很正第二性价比很高价格第三服务很好发票问题中途咨询等等都让人非常满意,irr
还可以吧啊啊啊啊啊啊啊啊啊啊,irr
开机很快运行速度也不错使用一段时间暂时一切正常,rel
用了一阵来评价挺好的就是由于价格问题给我折腾了下希望店家灵活些东西正没问题不用上图了吧都一样,irr
可以的很好,irr
是正品非常好物流也快下单第二天就到了,irr
电脑很满意键盘手感很好唯一感觉不太理想的是电脑没分区只有一个盘不知道以后电脑坏了文件是否会丢失,irr
配置到位性能优越开机快捷反应迅速大屏清晰重量较轻键盘舒适运行安静工作所需完全适用全方位好评自己的上一台电脑用了八年多现在反应太慢噪音太大作为陪自己历经风雨的老将只能收藏养老啦果断入手这款E580满足我的所有需求客服耐心解答咨询问题大赞,irr
可以电脑可以不错不错,irr
触摸板真的很有用瞬间把mac变为触摸屏电脑价格应该更优惠些,irr
老客户了服务好产品棒推荐大家来来来,irr
不错性能很好尺寸也正好,rel
苹果的东站京东物流还算是让人放心的,irr
各种事儿捣鼓了半个多月才清了,irr
618买还是挺实惠机器不错没有问题快递很快客服回复也很及时128G目前够用纠结的朋友先了解一下2017款无bar的是可以更换ssd的云服务也很方便,irr
很赞电池循环次数2次查序列号保修满一年的外观正常无损伤磕碰开机就给人惊艳的感觉前度用户买了128G目前内存系统和软件占了30+G还剩91G可用后面应该还可以可以开启自己灵感创作之路了,irr
整体还不错屏幕音效是亮点有时还会发烫价格偏贵,irr
是正品很愉快的一次京东购物,irr
轻续航长贵接口太少配件贵,irr
外观漂亮性价比高散热很好配置不错看电影不错硬件不错键盘不错屏幕大开机速度,rel
经常网购总有大量的包裹收感觉写评语花掉了我大量的时间和精力所以在一段时间里我总是不去评价或者随便写写但是我又总是觉得好像有点对不住那些辛苦工作的卖家客服仓管老板于是我写下了一小段话给我觉得能拿到我五星好评的卖家的宝贝评价里面以示感谢和尊敬首先宝贝是性价比很高的我每次都会先试用再评价的虽然宝贝不一定是最好的但在同等的价位里面绝对是表现最棒的京东的配送绝对是一流的送货速度快配送员服务态度好每样东西都是送货上门希望京东能再接再厉做得更大更强提供更多更好的东西给大家为京东的商品和服务点赞,irr
是正品不错很舒服,irr
发货快使用快超赞发票都可以开专票客服一流,irr
包装好价格比平时便宜,irr
很好期待中的美观实用系统还没有去使用但是外观很满意,irr
京东自营的正品非常适合学生使用,irr
arfgsdrztrtgwertgWEsfdxvrtfgWsedfxcRSGDvWSzcxerfg,irr
品质传承的经典响应速度快存储空间大大方超薄又有质感还送了电脑包和鼠标非常满意,irr
机身轻薄运行快速外观漂亮灭李好看落落大方,rel
联想笔记本5399京东送货快价格没有比较过跟其他商家相比不知是否有优势,irr
还不错哦很轻薄比pro拿着轻松很多,irr
11111111,irr
还是不错的比之前的老款精致了些小黑小红点一如即往只是USB30比之前重装系统要麻烦些好在折腾半天完成,irr
我为什么喜欢在京东买东西因为今天买明天就可以送到我为什么每个商品的评价都一样因为在京东买的东西太多太多了导致积累了很多未评价的订单所以我统一用段话作为评价内容京东购物这么久有买到很好的产品也有买到比较坑的产品如果我用这段话来评价说明这款产品没问题至少85分以上而比较垃圾的产品我绝对不会偷懒到复制粘贴评价我绝对会用心的差评这样其他消费者在购买的时候会作为参考会影响该商品销量而商家也会因此改进商品质量,irr
总体还可以重量还是重了一些开机速度很快散热也还可以一般办公用没什么问题,irr
不错是电脑也是艺术品感谢客服的耐心,irr
还可以信赖得品牌质量可以,irr
